{
  "format": "spriteops",
  "version": 1,
  "canvas": { "w": 32, "h": 32 },
  "palette": [
    "#00000000",
    "#000000",
    "#f0c070",
    "#4080d0",
    "#3060a0",
    "#c0c0c0",
    "#ffffff",
    "#8b4513",
    "#654321",
    "#ffcc00",
    "#2d1b0e"
  ],
  "animations": {
    "idle": { "loop": true, "frames": [0] },
    "walk": { "loop": true, "frames": [0, 1, 2, 3] }
  },
  "frames": [
    {
      "durationMs": 150,
      "ops": [
        ["clear", 0],

        ["layer_begin", "cape"],
        ["ellipse_fill", 4, 14, 18, 5, 7],
        ["layer_end"],

        ["layer_begin", "legs"],
        ["rect_fill", 7, 11, 22, 3, 6],
        ["rect_fill", 7, 17, 22, 3, 6],
        ["layer_end"],

        ["layer_begin", "boots"],
        ["rect_fill", 8, 10, 27, 5, 3],
        ["rect_fill", 8, 16, 27, 5, 3],
        ["layer_end"],

        ["layer_begin", "torso"],
        ["rect_fill", 3, 10, 12, 11, 10],
        ["layer_end"],

        ["layer_begin", "belt"],
        ["rect_fill", 8, 10, 21, 11, 2],
        ["pixel", 9, 15, 21],
        ["layer_end"],

        ["layer_begin", "arms"],
        ["rect_fill", 2, 7, 14, 3, 6],
        ["rect_fill", 2, 21, 14, 3, 6],
        ["layer_end"],

        ["layer_begin", "sword"],
        ["rect_fill", 5, 23, 6, 2, 14],
        ["pixel", 6, 23, 5],
        ["pixel", 6, 24, 5],
        ["rect_fill", 9, 21, 19, 6, 2],
        ["rect_fill", 8, 23, 20, 2, 3],
        ["layer_end"],

        ["layer_begin", "head"],
        ["ellipse_fill", 2, 15, 7, 5, 5],
        ["layer_end"],

        ["layer_begin", "hair"],
        ["ellipse_fill", 7, 15, 5, 5, 3],
        ["layer_end"],

        ["layer_begin", "face"],
        ["pixel", 1, 13, 7],
        ["pixel", 1, 17, 7],
        ["pixel", 6, 13, 6],
        ["pixel", 6, 17, 6],
        ["layer_end"],

        ["layer_merge", "final"],
        ["outline", 1, 1]
      ]
    },
    {
      "durationMs": 150,
      "ops": [
        ["clear", 0],

        ["layer_begin", "cape"],
        ["ellipse_fill", 4, 14, 18, 5, 7],
        ["layer_end"],

        ["layer_begin", "legs"],
        ["rect_fill", 7, 10, 22, 3, 6],
        ["rect_fill", 7, 18, 22, 3, 6],
        ["layer_end"],

        ["layer_begin", "boots"],
        ["rect_fill", 8, 9, 27, 5, 3],
        ["rect_fill", 8, 17, 27, 5, 3],
        ["layer_end"],

        ["layer_begin", "torso"],
        ["rect_fill", 3, 10, 11, 11, 11],
        ["layer_end"],

        ["layer_begin", "belt"],
        ["rect_fill", 8, 10, 21, 11, 2],
        ["pixel", 9, 15, 21],
        ["layer_end"],

        ["layer_begin", "arms"],
        ["rect_fill", 2, 6, 13, 3, 7],
        ["rect_fill", 2, 22, 15, 3, 5],
        ["layer_end"],

        ["layer_begin", "sword"],
        ["rect_fill", 5, 22, 5, 2, 15],
        ["pixel", 6, 22, 4],
        ["pixel", 6, 23, 4],
        ["rect_fill", 9, 20, 19, 6, 2],
        ["rect_fill", 8, 22, 20, 2, 3],
        ["layer_end"],

        ["layer_begin", "head"],
        ["ellipse_fill", 2, 15, 6, 5, 5],
        ["layer_end"],

        ["layer_begin", "hair"],
        ["ellipse_fill", 7, 15, 4, 5, 3],
        ["layer_end"],

        ["layer_begin", "face"],
        ["pixel", 1, 13, 6],
        ["pixel", 1, 17, 6],
        ["pixel", 6, 13, 5],
        ["pixel", 6, 17, 5],
        ["layer_end"],

        ["layer_merge", "final"],
        ["outline", 1, 1]
      ]
    },
    {
      "durationMs": 150,
      "ops": [
        ["clear", 0],

        ["layer_begin", "cape"],
        ["ellipse_fill", 4, 14, 18, 5, 7],
        ["layer_end"],

        ["layer_begin", "legs"],
        ["rect_fill", 7, 11, 22, 3, 6],
        ["rect_fill", 7, 17, 22, 3, 6],
        ["layer_end"],

        ["layer_begin", "boots"],
        ["rect_fill", 8, 10, 27, 5, 3],
        ["rect_fill", 8, 16, 27, 5, 3],
        ["layer_end"],

        ["layer_begin", "torso"],
        ["rect_fill", 3, 10, 12, 11, 10],
        ["layer_end"],

        ["layer_begin", "belt"],
        ["rect_fill", 8, 10, 21, 11, 2],
        ["pixel", 9, 15, 21],
        ["layer_end"],

        ["layer_begin", "arms"],
        ["rect_fill", 2, 7, 14, 3, 6],
        ["rect_fill", 2, 21, 14, 3, 6],
        ["layer_end"],

        ["layer_begin", "sword"],
        ["rect_fill", 5, 23, 6, 2, 14],
        ["pixel", 6, 23, 5],
        ["pixel", 6, 24, 5],
        ["rect_fill", 9, 21, 19, 6, 2],
        ["rect_fill", 8, 23, 20, 2, 3],
        ["layer_end"],

        ["layer_begin", "head"],
        ["ellipse_fill", 2, 15, 7, 5, 5],
        ["layer_end"],

        ["layer_begin", "hair"],
        ["ellipse_fill", 7, 15, 5, 5, 3],
        ["layer_end"],

        ["layer_begin", "face"],
        ["pixel", 1, 13, 7],
        ["pixel", 1, 17, 7],
        ["pixel", 6, 13, 6],
        ["pixel", 6, 17, 6],
        ["layer_end"],

        ["layer_merge", "final"],
        ["outline", 1, 1]
      ]
    },
    {
      "durationMs": 150,
      "ops": [
        ["clear", 0],

        ["layer_begin", "cape"],
        ["ellipse_fill", 4, 14, 18, 5, 7],
        ["layer_end"],

        ["layer_begin", "legs"],
        ["rect_fill", 7, 12, 22, 3, 6],
        ["rect_fill", 7, 16, 22, 3, 6],
        ["layer_end"],

        ["layer_begin", "boots"],
        ["rect_fill", 8, 11, 27, 5, 3],
        ["rect_fill", 8, 15, 27, 5, 3],
        ["layer_end"],

        ["layer_begin", "torso"],
        ["rect_fill", 3, 10, 13, 11, 9],
        ["layer_end"],

        ["layer_begin", "belt"],
        ["rect_fill", 8, 10, 21, 11, 2],
        ["pixel", 9, 15, 21],
        ["layer_end"],

        ["layer_begin", "arms"],
        ["rect_fill", 2, 8, 15, 3, 5],
        ["rect_fill", 2, 20, 13, 3, 7],
        ["layer_end"],

        ["layer_begin", "sword"],
        ["rect_fill", 5, 24, 7, 2, 13],
        ["pixel", 6, 24, 6],
        ["pixel", 6, 25, 6],
        ["rect_fill", 9, 22, 19, 6, 2],
        ["rect_fill", 8, 24, 20, 2, 3],
        ["layer_end"],

        ["layer_begin", "head"],
        ["ellipse_fill", 2, 15, 8, 5, 5],
        ["layer_end"],

        ["layer_begin", "hair"],
        ["ellipse_fill", 7, 15, 6, 5, 3],
        ["layer_end"],

        ["layer_begin", "face"],
        ["pixel", 1, 13, 8],
        ["pixel", 1, 17, 8],
        ["pixel", 6, 13, 7],
        ["pixel", 6, 17, 7],
        ["layer_end"],

        ["layer_merge", "final"],
        ["outline", 1, 1]
      ]
    }
  ]
}

